{
  "schema_version": "0.1.0",
  "architecture_id": "IAB-VADA-DU-001",
  "architecture_revision": 1,
  "architecture_status": "approved",
  "approval_source_ref": "SRC-016",
  "updated_at": "2026-08-03T18:03:47+09:00",
  "delivery_unit_ref": "FLOW-FIN-001@R2",
  "objective_ko": "권한 보유자가 하나 이상의 품목을 제출하고, 성공 여부와 저장된 요청을 자신의 요청 목록에서 다시 확인합니다.",
  "contract_bundle_ref": {
    "path": "contracts/bundles/CB-FIN-001/R1.json",
    "bundle_id": "CB-FIN-001",
    "bundle_revision": 1,
    "canonical_sha256": "cb4ac51a822e69b8a12584116da12e8437b4e61ce87802c88e107259e00863fb"
  },
  "decision_scope": {
    "mode": "production",
    "binding": "binding",
    "applies_to_ko": [
      "FLOW-FIN-001@R2 행사 구매 요청 제출의 제품 코드·테스트·배포 산출물",
      "VADA 운영 제품의 기존 승인 기술 기준"
    ],
    "excludes_ko": [
      "후속 구매 요청 검토·보완·구매·증빙·감사보고서 흐름",
      "모바일 네이티브 앱",
      "파일 업로드·멀웨어 검사 파이프라인 자체",
      "캐시·검색·AI 기능"
    ],
    "production_stack_status": "approved"
  },
  "sources": [
    {
      "id": "SRC-001",
      "type": "approved_artifact",
      "captured_at": "2026-08-03T08:52:16.906Z",
      "locator": "contracts/bundles/CB-FIN-001/R1.json#cb4ac51a822e69b8a12584116da12e8437b4e61ce87802c88e107259e00863fb",
      "content_ko": "제품 책임자가 승인한 행사 구매 요청 제출 실행 계약 묶음 R1입니다."
    },
    {
      "id": "SRC-002",
      "type": "approved_artifact",
      "captured_at": "2026-08-03T08:52:16.906Z",
      "locator": "product-specs/solutions/SOLUTION-FIN-001/R1.json#aad98632c5760e3b0f5cf7529a88308fd5d53812868e84257b80bb71acb76a6f",
      "content_ko": "제품 책임자가 승인한 행사 구매 요청 제출 목표 동작 설계 R1입니다."
    },
    {
      "id": "SRC-003",
      "type": "repository_evidence",
      "captured_at": "2026-08-03T08:52:16.906Z",
      "locator": "AGENTS.md",
      "content_ko": "VADA 저장소는 React SPA, FastAPI 모듈형 모놀리스, AWS 서버리스 스택과 재평가 트리거 전 임의 변경 금지를 명시합니다."
    },
    {
      "id": "SRC-004",
      "type": "user_statement",
      "captured_at": "2026-08-03T08:52:16.906Z",
      "locator": "https://app.notion.com/p/3a068a85148e80ca89e0f726a38d49f3",
      "content_ko": "기술 스택 & 아키텍처 페이지가 상태 확정으로 React·FastAPI·PostgreSQL·Cognito·AWS·품질 게이트의 제품 기준선을 승인해 기록합니다."
    },
    {
      "id": "SRC-005",
      "type": "approved_artifact",
      "captured_at": "2026-08-03T08:52:16.906Z",
      "locator": "https://app.notion.com/p/3a068a85148e81f2addce3b7ae41eb2b",
      "content_ko": "React 19.2와 React Compiler를 채택하고 Vue·Svelte·Solid·Angular 대안을 비교한 프론트엔드 ADR입니다."
    },
    {
      "id": "SRC-006",
      "type": "approved_artifact",
      "captured_at": "2026-08-03T08:52:16.906Z",
      "locator": "https://app.notion.com/p/3a068a85148e8169b883f5992328624d",
      "content_ko": "FastAPI와 Pydantic v2를 확정하고 Litestar 대안을 비교한 백엔드 ADR입니다."
    },
    {
      "id": "SRC-007",
      "type": "approved_artifact",
      "captured_at": "2026-08-03T08:52:16.906Z",
      "locator": "https://app.notion.com/p/3a068a85148e81769e2df889c46213d6",
      "content_ko": "단일 배포 단위의 모듈형 모놀리스를 확정하고 마이크로서비스와 무구조 단일 앱을 비교한 ADR입니다."
    },
    {
      "id": "SRC-008",
      "type": "approved_artifact",
      "captured_at": "2026-08-03T08:52:16.906Z",
      "locator": "https://app.notion.com/p/3a068a85148e81a28214d858b010e850",
      "content_ko": "RDS PostgreSQL 단일 인스턴스를 채택하고 Aurora Serverless v2·Aurora DSQL·EC2 자체 운영을 비교한 ADR입니다."
    },
    {
      "id": "SRC-009",
      "type": "approved_artifact",
      "captured_at": "2026-08-03T08:52:16.906Z",
      "locator": "https://app.notion.com/p/3a068a85148e81f892a0f6ed1a7f2cf6",
      "content_ko": "Cognito Essentials와 Managed Login을 확정하고 외부 인증 SaaS와 자체 구현을 비교한 ADR입니다."
    },
    {
      "id": "SRC-010",
      "type": "approved_artifact",
      "captured_at": "2026-08-03T08:52:16.906Z",
      "locator": "https://app.notion.com/p/3a268a85148e8184941dda800d61eb57",
      "content_ko": "행동 권한 카탈로그와 조직 역할 테이블 기반 자체 RBAC를 채택하고 OpenFGA·pycasbin·Cerbos를 비교한 ADR입니다."
    },
    {
      "id": "SRC-011",
      "type": "approved_artifact",
      "captured_at": "2026-08-03T08:52:16.906Z",
      "locator": "https://app.notion.com/p/3a068a85148e81208b12f260b27c08ca",
      "content_ko": "Lambda 컨테이너 이미지와 Lambda Web Adapter를 채택하고 Mangum·ZIP·Fargate를 비교한 ADR입니다."
    },
    {
      "id": "SRC-012",
      "type": "approved_artifact",
      "captured_at": "2026-08-03T08:52:16.906Z",
      "locator": "https://app.notion.com/p/3a268a85148e8195aed0eade6ab59b9a",
      "content_ko": "Powertools·CloudWatch·X-Ray·장애 알람을 확정하고 외부 APM을 비교한 관측성 ADR입니다."
    },
    {
      "id": "SRC-013",
      "type": "approved_artifact",
      "captured_at": "2026-08-03T08:52:16.906Z",
      "locator": "https://app.notion.com/p/3a068a85148e818397fbd15acf2b053d",
      "content_ko": "pytest·Testcontainers·Schemathesis 기반 실제 PostgreSQL 통합 검증을 채택한 백엔드 테스트 ADR입니다."
    },
    {
      "id": "SRC-014",
      "type": "approved_artifact",
      "captured_at": "2026-08-03T08:52:16.906Z",
      "locator": "https://app.notion.com/p/3a068a85148e81088732d7d57c22e82f",
      "content_ko": "Vitest·Playwright·MSW 기반 웹 테스트와 ESLint 품질 게이트를 채택한 프론트엔드 ADR입니다."
    },
    {
      "id": "SRC-015",
      "type": "approved_artifact",
      "captured_at": "2026-08-03T08:52:16.906Z",
      "locator": "https://app.notion.com/p/3a268a85148e810b949dce9d7569a7d7",
      "content_ko": "Playwright 시각 회귀와 axe 접근성 게이트를 채택하고 관리형 SaaS 대안을 비교한 QA ADR입니다."
    },
    {
      "id": "SRC-016",
      "type": "user_statement",
      "captured_at": "2026-08-03T18:03:47+09:00",
      "locator": "current-thread/iab-vada-du-001-approval-2026-08-03",
      "content_ko": "제품 책임자가 행사 구매 요청 제출 구현 아키텍처 기준선 전체를 명시적으로 승인했습니다."
    }
  ],
  "decisions": [
    {
      "id": "ADR-001",
      "revision": 1,
      "status": "accepted",
      "supersedes": null,
      "title_ko": "구매 요청 웹 클라이언트 기준선",
      "category": "frontend",
      "scope": "production",
      "context_ko": "다품목 폼, 서버 초안 상태, 접근 가능한 오류와 제출 후 목록 이동을 데스크탑 우선 웹에서 일관되게 구현해야 합니다.",
      "options": [
        {
          "id": "VADA_REACT_SPA",
          "label_ko": "VADA 승인 React SPA 스택",
          "selection": {
            "framework": "React 19.2 + React Compiler",
            "language": "TypeScript 6.0",
            "build": "Vite 8 SPA",
            "routing_data_form": "TanStack Router·Query·Form + Zod 4",
            "ui": "Tailwind CSS 4 + shadcn/ui(Base UI)"
          },
          "tradeoffs_ko": [
            "기존 제품 기준·AI 생태계·인수인계 가능성이 높지만 SSR·SEO가 필요해지면 별도 재평가가 필요합니다.",
            "React Compiler 규칙을 따르므로 임의의 수동 메모이제이션을 금지합니다."
          ],
          "source_refs": [
            "SRC-004",
            "SRC-005"
          ]
        },
        {
          "id": "VUE_VITE_SPA",
          "label_ko": "Vue 3 + Vite SPA",
          "selection": {
            "framework": "Vue 3",
            "language": "TypeScript",
            "build": "Vite SPA"
          },
          "tradeoffs_ko": [
            "러닝커브와 단일 파일 컴포넌트 생산성은 좋지만 VADA의 승인 생태계·React Native 확장·에이전트 학습 코퍼스와 어긋납니다."
          ],
          "source_refs": [
            "SRC-005"
          ]
        }
      ],
      "selected_option_id": "VADA_REACT_SPA",
      "decision_ko": "제품 전체에 승인된 React SPA 스택을 이 흐름에도 적용합니다.",
      "consequences_ko": [
        "폼 입력과 서버 초안은 TanStack Form·Query 경계로 분리하고 브라우저 영속 저장을 정본으로 사용하지 않습니다.",
        "오류 요약·입력 포커스·상태 메시지는 Playwright와 접근성 테스트가 관찰할 수 있게 구현합니다."
      ],
      "reversibility": "moderate",
      "blast_radius": "product",
      "source_refs": [
        "SRC-001",
        "SRC-002",
        "SRC-003",
        "SRC-004",
        "SRC-005"
      ],
      "approval_source_ref": "SRC-004"
    },
    {
      "id": "ADR-002",
      "revision": 1,
      "status": "accepted",
      "supersedes": null,
      "title_ko": "구매 요청 API와 서버 구조 기준선",
      "category": "backend",
      "scope": "production",
      "context_ko": "권한 판정, 전체 입력 재검증, 원자적 제출과 여섯 HTTP 동작을 한 팀이 장기 유지보수할 수 있는 서버 구조가 필요합니다.",
      "options": [
        {
          "id": "FASTAPI_MODULAR_MONOLITH",
          "label_ko": "FastAPI 모듈형 모놀리스",
          "selection": {
            "runtime": "Python 3.13",
            "framework": "FastAPI + Pydantic v2",
            "architecture": "단일 배포 단위의 finance 도메인 모듈",
            "api": "REST + OpenAPI 3.1.1"
          },
          "tradeoffs_ko": [
            "배포와 디버깅이 단순하고 도메인 경계를 CI로 강제할 수 있지만 독립 배포는 제공하지 않습니다."
          ],
          "source_refs": [
            "SRC-004",
            "SRC-006",
            "SRC-007"
          ]
        },
        {
          "id": "LITESTAR_MODULAR_MONOLITH",
          "label_ko": "Litestar 모듈형 모놀리스",
          "selection": {
            "runtime": "Python 3.13",
            "framework": "Litestar",
            "architecture": "단일 배포 단위의 도메인 모듈"
          },
          "tradeoffs_ko": [
            "일부 내장 기능은 앞서지만 생태계·AI 학습 코퍼스·팀 학습 비용이 FastAPI보다 불리합니다."
          ],
          "source_refs": [
            "SRC-006",
            "SRC-007"
          ]
        }
      ],
      "selected_option_id": "FASTAPI_MODULAR_MONOLITH",
      "decision_ko": "FastAPI 단일 앱의 finance 모듈로 구현하고 OpenAPI를 클라이언트 생성 기준으로 사용합니다.",
      "consequences_ko": [
        "권한 의존성은 모든 라우트 선언부에 보이고 역할명 직접 비교는 금지합니다.",
        "finance 모듈 경계를 import-linter로 강제하며 다른 도메인과의 직접 결합을 만들지 않습니다."
      ],
      "reversibility": "moderate",
      "blast_radius": "product",
      "source_refs": [
        "SRC-001",
        "SRC-002",
        "SRC-003",
        "SRC-004",
        "SRC-006",
        "SRC-007"
      ],
      "approval_source_ref": "SRC-004"
    },
    {
      "id": "ADR-003",
      "revision": 1,
      "status": "accepted",
      "supersedes": null,
      "title_ko": "구매 요청 영속성과 트랜잭션 기준선",
      "category": "persistence",
      "scope": "production",
      "context_ko": "요청·품목·초안 제거의 원자성, 멱등성, 조직 격리와 재조회 영속성을 관계형 제약과 트랜잭션으로 보장해야 합니다.",
      "options": [
        {
          "id": "RDS_POSTGRES_SYNC",
          "label_ko": "RDS PostgreSQL + 동기 SQLAlchemy",
          "selection": {
            "database": "Amazon RDS PostgreSQL 단일 인스턴스",
            "orm": "SQLAlchemy 2.x",